{
  "artifact_path": "promotion_cloud_training_completion_receipt.json",
  "created_at": "2026-07-03T00:30:00+00:00",
  "execution": {
    "failure": {
      "class": "none",
      "classified": true,
      "message": ""
    },
    "status": "completed",
    "terminal": true
  },
  "execution_boundary": {
    "artifacts_downloaded_by_flight_recorder": false,
    "artifacts_uploaded_by_flight_recorder": false,
    "cloud_job_started_by_flight_recorder": false,
    "credential_values_recorded_by_flight_recorder": false,
    "external_runner_owns_execution": true,
    "import_only": true,
    "model_downloads_started_by_flight_recorder": false,
    "provider_api_called_by_flight_recorder": false,
    "provider_modules_imported_by_flight_recorder": false,
    "provider_status_polled_by_flight_recorder": false,
    "raw_provider_result_embedded": false,
    "weights_updated_by_flight_recorder": false
  },
  "governance": {
    "blocking_reasons": [],
    "cloud_training_completion_claims_allowed": true,
    "readiness": "ready_for_review",
    "recommendation": "review_cloud_training_completion"
  },
  "identity": {
    "agentic_training_plan_sha256": "43c70e36211d58beccfaad6a2536b5f7fe5fb926813607195b1b29bee0fb347b",
    "candidate_model_id": "local/mock-candidate",
    "digest_sha256": "1d5012c35a51e444b733895c482f5b1a31ea02f38bb14276ec20bfca036e759a",
    "execution_id": "promotion-cloud-training-001",
    "launch_plan_sha256": "7b9476f9fd8d36bd2ac8a1fa30092140752c026d744c913ad2b2eff7ab980a4f",
    "launch_receipt_sha256": "30c933ebda010b75fb8afb4efe15a4546035313061a275a23d450ca08949aeb8",
    "output_artifact_manifest_sha256": "b44545f5fbca1d5f8b2ee32137b08165f4fc024bb1ebc4add6c09e6301af091b",
    "output_artifact_set_sha256": "56915b1cfa436f869cf8863c22427840e8f9df916745eee715b3a668dfb8293b",
    "provider_id": "modal",
    "provider_job_id": "promotion-modal-job-001",
    "raw_provider_result_sha256": "8be5d484f596515e282e3abcf45dae4536d731c8e91f00096298b664d550277d",
    "result_run_id": "synthetic-promotion-completed-001",
    "runner_id": "synthetic-external-cloud-runner",
    "runner_metadata_sha256": "4684fc873b03d75810bfda1d5b8ffdd1a440e95969efaa5a5ae8efd605f45ff4",
    "runner_version": "1",
    "status_receipt_sha256": "1619635781b45a90c3264d55890166f30a1200922629b951e6ce791b5953681b"
  },
  "integrity": {
    "blocking_reasons": [],
    "check_count": 31,
    "checks": [
      {
        "id": "direct_sources_replayable",
        "passed": true,
        "summary": "all direct evidence sources must be stable replayable regular files"
      },
      {
        "id": "direct_sources_distinct",
        "passed": true,
        "summary": "direct evidence sources must not alias one another"
      },
      {
        "id": "source_json_duplicate_free",
        "passed": true,
        "summary": "control-plane JSON sources must be duplicate-free finite JSON objects"
      },
      {
        "id": "upstream_schemas_valid",
        "passed": true,
        "summary": "cloud launch/status and output-manifest schemas must validate"
      },
      {
        "id": "upstream_semantics_valid",
        "passed": true,
        "summary": "cloud launch/status and output-manifest semantic validators must pass"
      },
      {
        "id": "linked_control_source_closure_bounded",
        "passed": true,
        "summary": "linked control evidence must remain a bounded replayable JSON closure"
      },
      {
        "id": "launch_receipt_binds_launch_plan",
        "passed": true,
        "summary": "launch receipt must bind the supplied launch plan by SHA-256"
      },
      {
        "id": "status_receipt_binds_launch_receipt",
        "passed": true,
        "summary": "status receipt must bind the supplied launch receipt by SHA-256"
      },
      {
        "id": "runner_metadata_valid",
        "passed": true,
        "summary": "runner metadata must use the public import envelope"
      },
      {
        "id": "runner_binds_all_sources",
        "passed": true,
        "summary": "runner metadata must bind every supplied evidence source by SHA-256"
      },
      {
        "id": "provider_identity_matches",
        "passed": true,
        "summary": "runner provider identity must match the launch-plan provider"
      },
      {
        "id": "training_plan_lineage_converges",
        "passed": true,
        "summary": "cloud preflight and agentic training result must bind the same training plan"
      },
      {
        "id": "provider_constraints_match",
        "passed": true,
        "summary": "reported region, GPU class, and cost must satisfy the preflight limits"
      },
      {
        "id": "execution_failure_coherent",
        "passed": true,
        "summary": "terminal outcomes and classified failures must be coherent"
      },
      {
        "id": "runner_started_after_launch_handoff",
        "passed": true,
        "summary": "runner execution must not predate the launch plan and launch receipt"
      },
      {
        "id": "completion_after_status_receipt",
        "passed": true,
        "summary": "completion import must not predate its status receipt"
      },
      {
        "id": "flight_recorder_import_only",
        "passed": true,
        "summary": "runner metadata must attest that Flight Recorder performed no provider or training side effects"
      },
      {
        "id": "credential_values_not_recorded",
        "passed": true,
        "summary": "runner must explicitly attest that credential values were not recorded"
      },
      {
        "id": "output_artifacts_current",
        "passed": true,
        "summary": "every output artifact must remain current, unique, nonempty when executable, and inside the declared output root"
      },
      {
        "id": "output_artifacts_disjoint_from_evidence",
        "passed": true,
        "summary": "output artifacts must not alias direct or linked control evidence"
      },
      {
        "id": "completed_external_provider_api_called",
        "passed": true,
        "summary": "completed execution requires externally owned provider API activity"
      },
      {
        "id": "completed_external_cloud_job_started",
        "passed": true,
        "summary": "completed execution requires an externally owned cloud job"
      },
      {
        "id": "completed_external_artifacts_downloaded",
        "passed": true,
        "summary": "completed execution requires the external runner to materialize the declared local outputs"
      },
      {
        "id": "completed_runner_exit_zero",
        "passed": true,
        "summary": "completed execution requires runner exit code zero"
      },
      {
        "id": "completed_result_manifest_passed",
        "passed": true,
        "summary": "completed execution requires a passing completed agentic training result"
      },
      {
        "id": "completed_candidate_matches",
        "passed": true,
        "summary": "completed execution candidate must match the agentic result registry target"
      },
      {
        "id": "completed_result_run_id_matches",
        "passed": true,
        "summary": "runner metadata and agentic training result must identify the same result run"
      },
      {
        "id": "completed_result_after_runner_finish",
        "passed": true,
        "summary": "terminal agentic training result must not predate runner completion"
      },
      {
        "id": "completed_result_before_completion_import",
        "passed": true,
        "summary": "agentic training result must not postdate completion import"
      },
      {
        "id": "completed_outputs_nonempty",
        "passed": true,
        "summary": "completed execution requires at least one adapter or checkpoint"
      },
      {
        "id": "sources_stable_after_validation",
        "passed": true,
        "summary": "direct evidence sources must remain stable throughout semantic validation"
      }
    ],
    "failed_check_count": 0,
    "passed": true
  },
  "notes": [
    "This receipt imports externally reported evidence; it does not verify provider authenticity.",
    "Flight Recorder does not call or poll providers, upload or download artifacts, import provider SDKs, start cloud jobs, or update weights while building this receipt.",
    "Receipt integrity is independent from execution outcome; valid failed, incomplete, and unknown outcomes remain auditable but cannot enable completion claims."
  ],
  "outputs": {
    "artifact_count": 4,
    "artifact_set_sha256": "56915b1cfa436f869cf8863c22427840e8f9df916745eee715b3a668dfb8293b",
    "candidate_model_id": "local/mock-candidate",
    "created_at": "2026-07-03T00:20:00+00:00",
    "manifest_schema_version": "hfr.agentic_training_result.v1",
    "manifest_sha256": "b44545f5fbca1d5f8b2ee32137b08165f4fc024bb1ebc4add6c09e6301af091b",
    "output_artifact_count": 1,
    "regular_artifact_count": 4,
    "run_id": "synthetic-promotion-completed-001"
  },
  "passed": true,
  "provider_constraints": {
    "cost_within_limit": true,
    "gpu_class": "a100",
    "max_cost_usd": 0.0,
    "region": "provider_default",
    "reported_cost_usd": 0
  },
  "runner_observation": {
    "exit_code": 0,
    "finished_at": "2026-07-03T00:20:00+00:00",
    "observed_at": "2026-07-03T00:20:00+00:00",
    "result_run_id": "synthetic-promotion-completed-001",
    "runner_id": "synthetic-external-cloud-runner",
    "runner_version": "1",
    "side_effects": {
      "artifacts_downloaded_by_flight_recorder": false,
      "artifacts_uploaded_by_flight_recorder": false,
      "cloud_job_started_by_flight_recorder": false,
      "credential_values_recorded": "not_observed",
      "external_artifacts_downloaded": true,
      "external_artifacts_uploaded": true,
      "external_cloud_job_started": true,
      "external_provider_api_called": true,
      "model_downloads_started_by_flight_recorder": false,
      "provider_api_called_by_flight_recorder": false,